
<report-group xmlns:xsi="http://www.w3.org/2001/XMLSchema-instance" 
              xmlns="http://xmlns.oracle.com/coherence/coherence-report-group-config"
              xsi:schemaLocation="http://xmlns.oracle.com/coherence/coherence-report-group-config coherence-report-group-config.xsd">

  <frequency>1m</frequency>
  <output-directory>./</output-directory>
  <report-list>
    <report-config>
      <location>reports/report-node.xml</location>
    </report-config>
    <report-config>
      <location>reports/report-network-health.xml</location>
    </report-config>
    <report-config>
      <location>reports/report-network-health-detail.xml</location>
    </report-config>
    <report-config>
      <location>reports/report-memory-status.xml</location>
    </report-config>
    <report-config>
      <location>reports/report-service.xml</location>
    </report-config>
    <report-config>
      <location>reports/report-cache-effectiveness.xml</location>
    </report-config>
    <report-config>
      <location>reports/report-proxy.xml</location>
    </report-config>
    <report-config>
      <location>reports/report-management.xml</location>
    </report-config>
    <report-config>
      <location>reports/report-flashjournal.xml</location>
    </report-config>
    <report-config>
      <location>reports/report-ramjournal.xml</location>
    </report-config>
  </report-list>
</report-group>

